_id,business_id,categories,city,is_open,name,review_count,stars,state
640ba2188e928c352265e540,q6Rln6JUAr8ALqbTNZs2ag,"Restaurants, Cafes, American (New), Bakeries, Food, Italian",Tampa,1,Pane Rustica,468,4.5,FL
640ba2188e928c352265e541,RF2nNrvOV8n3lFPCd2jfpg,"Restaurants, Vietnamese",Tampa,0,Banh Mi House,108,4.5,FL
640ba2188e928c352265e542,vKYJHjoCymwJRJauWiLgWg,"Latin American, Restaurants, Hookah Bars, Bars, Nightlife",Tampa,1,The Latin Grill- Tampa,7,4.5,FL
640ba2188e928c352265e54c,cEuWViAZWCQEG-jbKaOv2g,"Sports Bars, Bars, Nightlife, Pubs, American (Traditional), American (New), Restaurants",Tampa,0,Beef 'O' Brady's,24,3.0,FL
640ba2188e928c352265e560,iqQCSTq604MRbrUwMNBeug,"Middle Eastern, Restaurants, Afghan, Nightlife, Bars",Tampa,0,Anaar Bar & Grill,51,4.0,FL
640ba2188e928c352265e561,AlH5V97JSAu7AL_xdibMIg,"Restaurants, Latin American, Laotian, Caribbean, Nightlife, American (Traditional), Seafood, Bars",Tampa,1,Bahama Breeze,1099,3.5,FL
640ba2188e928c352265e563,EfYHJN8e-VRIfWyML19gSg,"Mexican, Hawaiian, Restaurants",Tampa,0,California Tacos To Go,260,3.5,FL
640ba2188e928c352265e564,ZmrBi5D0BMcpKCf7HEVRWg,"Sandwiches, Fast Food, Cuban, Restaurants",Tampa,0,Delicias De EcuaCuba,8,4.5,FL
640ba2188e928c352265e566,cX-JMoOBUxjXCVQS31uRxQ,"Hotels & Travel, Resorts, Restaurants, Event Planning & Services, Steakhouses, Venues & Event Spaces, Hotels",Tampa,0,InterContinental Tampa,123,3.0,FL
640ba2188e928c352265e567,s2FmB9YjpULaowp1rKDtvw,"Restaurants, American (New), Beaches, Seafood, Active Life",Tampa,0,Hogan's Beach,284,2.5,FL
640ba2188e928c352265e569,K5OnEvUW2UNcLt_JWr0dfQ,"Caribbean, Restaurants",Tampa,0,Nicolettes Caribbean Cafe,31,4.0,FL
640ba2188e928c352265e56b,QpyvUColtSYH5VtkcrN6Xw,"Diners, Breakfast & Brunch, American (Traditional), Restaurants",Tampa,1,Metro Diner,628,4.5,FL
640ba2188e928c352265e570,cT2OaiaLGQa6fEZlgcQHKw,"Latin American, Burgers, Venezuelan, Food, Hot Dogs, Empanadas, Restaurants, Breakfast & Brunch",Tampa,0,Arepa Marketplace Latin Cafe,54,4.5,FL
640ba2188e928c352265e571,Ve5zx8XJN60-ohKUOGwQJg,"Vegetarian, Vegan, Restaurants, Southern",Tampa,1,Dharma Southern Kitchen,168,4.5,FL
640ba2188e928c352265e572,FSTLTRc_7BTgv99kWSnhIw,"Restaurants, Cuban",Tampa,1,Cuban Foodies,130,4.5,FL
640ba2188e928c352265e57b,DxXFnkSEiC9f3FwbE_nLRw,"Beer, Wine & Spirits, Food, Pubs, Wine Bars, Restaurants, American (New), Bars, Nightlife, Beer Bar, Sports Bars",Tampa,1,Yard of Ale Soho,102,3.0,FL
640ba2188e928c352265e57d,zKJtshIoSsDlWsCcZUmzZw,"American (Traditional), Nightlife, Pubs, Bars, Burgers, Sports Bars, Restaurants",Tampa,1,TGI Fridays,125,2.5,FL
640ba2188e928c352265e57e,x0JkV6KSVI_H83tv20rxDw,"Flowers & Gifts, Mexican, Restaurants, Children's Clothing, Fashion, Shopping",Tampa,0,Estella's,5,3.0,FL
640ba2188e928c352265e57f,rlQuvaHL0fTkzxUyB1X3jQ,"Mediterranean, Breakfast & Brunch, Buffets, Restaurants, Middle Eastern, Falafel",Tampa,0,Taste of Jerusalem,18,4.5,FL
640ba2188e928c352265e580,_9CzPGs9MrF-Ydam2VNT9w,"Food, Tacos, Mexican, Restaurants, Food Trucks",Tampa,1,Tacos Gone Mobile,73,4.5,FL
640ba2188e928c352265e581,vKTTtmv9-xoM9IecE68DpA,"Restaurants, American (New), Seafood, Bars, Steakhouses, American (Traditional), Food, Nightlife, Breakfast & Brunch",Tampa,1,Grillsmith - Carrollwood,350,4.0,FL
640ba2188e928c352265e582,UviNsy6qq0aOLl52BOzWow,"Restaurants, Food, Food Trucks, Asian Fusion",Tampa,1,I Wanna Wok,55,4.0,FL
640ba2188e928c352265e583,k_W2VhhVe0AjbhqNrbdQHA,"Breakfast & Brunch, Tapas/Small Plates, Bars, Restaurants, Lounges, Food, Coffee & Tea, Cafes, Nightlife",Tampa,1,Gabriella's,8,3.0,FL
640ba2188e928c352265e587,OLKGZL0OVufGZyi2m8JdYA,"Cafes, American (Traditional), Restaurants, Burgers",Tampa,1,Hard Rock Cafe,107,3.0,FL
640ba2188e928c352265e588,lxb27ohlkrJrEv56O2A2qQ,"Breakfast & Brunch, Ice Cream & Frozen Yogurt, Fast Food, Juice Bars & Smoothies, Gluten-Free, Restaurants, Food, Wraps, Vegetarian, Salad",Tampa,0,Freshii,57,3.5,FL
640ba2188e928c352265e58c,hV0rmTB2S2fYzjQKlHtKuw,"Nightlife, Event Planning & Services, Restaurants, Bars, Venues & Event Spaces, American (New), Wine Bars, Cocktail Bars, Tapas/Small Plates",Tampa,1,Haven,372,4.0,FL
640ba2188e928c352265e58d,WVMfxStC0JxoA72nq-9QCg,"Italian, Bars, Nightlife, Restaurants",Tampa,0,Pelagia Trattoria,71,4.0,FL
640ba2188e928c352265e58f,zeFKiuNaQu7m-xp-Wh1cMw,"Cuban, Local Flavor, Restaurants, Sandwiches, Yelp Events",Tampa,0,Tu Sabor Cuban Restaurant,13,2.5,FL
640ba2188e928c352265e590,-nb8_qHFjnYgQAYbkZ_yDw,"Restaurants, Barbeque, Korean",Tampa,0,Gangnam Style Restaurant Tampa,19,5.0,FL
640ba2188e928c352265e597,56AIvAU0yxOfVKPGwONjuA,"Juice Bars & Smoothies, Coffee & Tea, Cafes, Vegan, Food, Restaurants, Specialty Food, Pizza",Tampa,1,Kodawari Cafe,8,4.0,FL
640ba2188e928c352265e59c,x4zIGn9xhUa7lY2jiKUtNw,"Auto Repair, Car Dealers, Automotive, Oil Change Stations, Restaurants, Body Shops, Pizza",Tampa,1,Budget Motorcars,5,4.0,FL
640ba2188e928c352265e59d,pQtNSf1YpZCOXZCbIYXXrQ,"Restaurants, Middle Eastern",Tampa,1,Morae's Cafe,8,3.5,FL
640ba2188e928c352265e5a2,fyaP6uYORNSZ2hnVT2EgRA,"Food, Specialty Food, Imported Food, Ethnic Food, Local Flavor, Restaurants, Grocery, Caribbean",Tampa,1,Habana Supermarket,11,4.5,FL
640ba2188e928c352265e5a6,_BVW1RVFyPELn6K_mhwIMQ,"Delis, Cafes, Restaurants, Sandwiches",Tampa,1,Moxie's Too Cafe & Deli,39,3.5,FL
640ba2188e928c352265e5a8,VhrLzGdITj0UTAu8YjkAKg,"Restaurants, Dominican, Breakfast & Brunch, Caribbean, Cafes, Puerto Rican",Tampa,1,Punta Cana Restaurant,10,4.5,FL
640ba2188e928c352265e5ab,x1ukXOcMHlzKmTmfNIjyLA,"Restaurants, Noodles, Thai, Pan Asian, Asian Fusion",Tampa,1,Asiatic Street Food & Noodle Bar,323,4.0,FL
640ba2188e928c352265e5ac,PhhCTXGAyW-0PGmcQZjOoQ,"American (New), Nightlife, Breakfast & Brunch, Restaurants, Bars",Tampa,1,WTR Pool & Grill,104,3.0,FL
640ba2188e928c352265e5b0,7EqJePBl_QA2ZpS-PQqFCw,"American (Traditional), Sandwiches, Food, Restaurants, Salad, Bakeries",Tampa,0,Camilleon Cookies & Salads,8,5.0,FL
640ba2188e928c352265e5b2,YkNz-yiDQq1hyNXStNrFkA,"Breakfast & Brunch, Cafes, Delis, Restaurants, Sandwiches",Tampa,0,Tarek's Cafe,14,4.5,FL
640ba2188e928c352265e5b5,W5gd3xNZD1-WJhhWA5h7fg,"Indian, Restaurants",Tampa,0,Southern Spices,13,3.5,FL
640ba2188e928c352265e5b8,o5DMQMa45xWM3mZqTVmsuw,"Restaurants, Specialty Food, Food, Ethnic Food, Cafes, Sushi Bars, Mexican, Japanese",Tampa,1,Yoshi Sushi,153,4.0,FL
640ba2188e928c352265e5b9,TXXR3im3cw5elCQT6EbASA,"Venues & Event Spaces, Nightlife, Event Planning & Services, Bars, American (New), Restaurants",Tampa,1,Bar Hwrd,32,3.5,FL
640ba2188e928c352265e5ba,oOmEd0K-1rpGo5FmvijMgA,"Cafes, Coffee & Tea, Restaurants, Food",Tampa,1,Starbucks,15,3.0,FL
640ba2188e928c352265e5bb,BQdozsc8akK4rbbFQTtflg,"Comfort Food, Hotels & Travel, Salad, Bed & Breakfast, Breakfast & Brunch, American (Traditional), Restaurants",Tampa,1,Bob Evans,64,3.0,FL
640ba2188e928c352265e5bc,FAqFtRj94IHvqe9XAPpRew,"Lounges, Steakhouses, Seafood, Bars, Live/Raw Food, American (New), Nightlife, Restaurants, Sushi Bars",Tampa,1,Aqua,210,3.5,FL
640ba2188e928c352265e5bf,dF7jymngJnonFa5r9RZSnw,"Vietnamese, Restaurants",Tampa,0,Banh Mi Ba Nhan,20,4.0,FL
640ba2188e928c352265e5c1,Zf_LzAe00MhewGtY_dPb_Q,"Imported Food, Restaurants, Ethnic Food, Caribbean, Specialty Food, Event Planning & Services, Food, Caterers",Tampa,1,Alez Caribbean Restaurant,8,2.5,FL
640ba2188e928c352265e5c4,MI7cUsPiQGYQRuQmn3MbtA,"Live/Raw Food, American (New), Breakfast & Brunch, Restaurants, Nightlife, American (Traditional), Bars",Tampa,0,Boca - Tampa,952,4.0,FL
640ba2188e928c352265e5c5,mpf51URhzEQQjc186BKUcA,"Restaurants, Cuban, Cafes, Breakfast & Brunch",Tampa,0,La Tropicana Cafe,114,2.5,FL
640ba2188e928c352265e5c7,cvK0OlVuTT5FuoYOaI3t5A,"Fast Food, Restaurants, Thai, Chinese, Japanese, Asian Fusion",Tampa,0,Wasa Asian Cuisine Restaurant,15,3.0,FL
640ba2188e928c352265e5ca,quDnwsZCafyusw6G4dhEdQ,"Restaurants, Filipino",Tampa,0,Chismis & co,20,4.5,FL
640ba2188e928c352265e5cb,llscutPmO-mUdNce1CJmDw,"Burgers, Fast Food, Restaurants",Tampa,1,Wendy's,35,2.0,FL
640ba2188e928c352265e5cd,1vpoEtiwQq51BI21RtKiHA,"Beer, Wine & Spirits, Restaurants, Food, American (New)",Tampa,0,Gilligan's,18,2.5,FL
640ba2188e928c352265e5d0,LzFG7Altfy8O0tPFBqlcKw,"Food, Fruits & Veggies, Food Stands, Mexican, Specialty Food, Food Trucks, Restaurants",Tampa,1,Elote Stand,7,4.5,FL
640ba2188e928c352265e5d5,5wGADsAswlIYb1dl0fnfeQ,"Mediterranean, Nightlife, Bars, Lounges, Restaurants",Tampa,1,Floridan Lounge,15,4.5,FL
640ba2188e928c352265e5e3,3esrPjBnk3bPu8DT7Y0mhQ,"Pizza, Chicken Wings, Food Delivery Services, Restaurants, Food",Tampa,0,D.P. Dough,48,3.5,FL
640ba2188e928c352265e5e4,k79ygmdDxEDXtLlR_rPrmQ,"Restaurants, Italian",Tampa,1,Bella's Italian Café,570,4.0,FL
640ba2188e928c352265e5eb,LD0OCq7t8er4CCDR7tov7g,"Restaurants, American (Traditional), Sports Bars, Bars, Nightlife, Chicken Wings",Tampa,1,Bilmar Station,50,4.0,FL
640ba2188e928c352265e5f2,TOgkopnDE5q9mT074TDeeA,"Sandwiches, Cafes, Restaurants, Bakeries, Coffee & Tea, Breakfast & Brunch, Food",Tampa,1,DI Coffee Bar,142,4.5,FL
640ba2188e928c352265e5f5,ffc52M0EHgEYQ9I1WqYzBQ,"Sandwiches, Pizza, Chicken Wings, Restaurants",Tampa,1,Domino's Pizza,12,2.0,FL
640ba2188e928c352265e5f8,HPmCGTlKSIpO64pHN5q40A,"Restaurants, Italian",Tampa,0,Romano's Macaroni Grill,15,2.0,FL
640ba2188e928c352265e5fb,UUDGbu6-nK97evc2LaevGQ,"Sicilian, Restaurants, Italian",Tampa,1,Casa Santo Stefano,206,4.0,FL
640ba2188e928c352265e5fc,YiSmznpxIFwSg-GLX_-vjQ,"Chinese, Restaurants",Tampa,1,Ho Ho To Go,38,3.5,FL
640ba2188e928c352265e600,4GXFK_FyQTZN7OUq_oXGvw,"Food, Food Delivery Services, Sandwiches, Restaurants, Fast Food, Delis",Tampa,0,Jimmy John's,18,3.5,FL
640ba2188e928c352265e603,Rf-p0k0HpqtD7L4YBfWjPQ,"Hawaiian, Poke, Food, Restaurants",Tampa,1,Poke 88,55,5.0,FL
640ba2188e928c352265e609,kh4Fz0hSdhJOKZQWAf_G0g,"Restaurants, Grocery, Bakeries, Food",Tampa,1,Publix,67,3.5,FL
640ba2188e928c352265e60a,ub_cFc5t2sgFSG-Ug2K7Qw,"Restaurants, Bars, Latin American, Colombian, Spanish, Nightlife",Tampa,1,ALMA Rest And Bar,63,3.5,FL
640ba2188e928c352265e60b,BBVrr3ZqmzfF1eD6hQJSYw,"Cafes, Breakfast & Brunch, Food, Restaurants",Tampa,0,Sunshine Cafe,10,3.0,FL
640ba2188e928c352265e60c,3NcOmtIxpfvp67bZnsprpQ,"Sandwiches, Ice Cream & Frozen Yogurt, Food, Cuban, Restaurants, Bakeries",Tampa,0,Soho Delicias Cuban Cafe & Frozen Yogurt,33,4.5,FL
640ba2188e928c352265e60e,1bwEz9wJwgfNFnBdW-rWkg,"Vietnamese, Home Services, Grocery, Restaurants, Real Estate, Food, Homeowner Association, International Grocery",Tampa,1,Lien Hoa Oriental Market,31,3.5,FL
640ba2188e928c352265e615,1ZW_rnoS2UBydTyc_0ikSQ,"Japanese, Restaurants, Sushi Bars, Ramen",Tampa,0,Sekushi,150,3.5,FL
640ba2188e928c352265e616,mgBZjhn2uwOcd8hHhjck9g,"Amusement Parks, Pizza, Beer, Wine & Spirits, Arts & Entertainment, Food, Arcades, Laser Tag, Restaurants, Event Planning & Services, Bars, Active Life, Team Building Activities, Sports Bars, Kids Activities, Nightlife, Party & Event Planning",Tampa,1,Laser Ops Extreme Gaming Arcade - Tampa,45,4.0,FL
640ba2188e928c352265e617,_GnGPftZCDeUKzjFWGqNsw,"Restaurants, Italian",Tampa,1,Cipresso Seminole Hard Rock  - Tampa,31,4.0,FL
640ba2188e928c352265e619,AsMmX7njOzFkWsJQ1jMVCg,"Tapas/Small Plates, Beverage Store, Breakfast & Brunch, Food, Butcher, Specialty Food, Sandwiches, Meat Shops, Restaurants, Cafes, American (New), Delis",Tampa,1,The Boozy Pig,134,4.5,FL
640ba2188e928c352265e61a,Mei_c_5J6XQmaXgpfrmLGQ,"Hot Pot, Restaurants, Shanghainese, Dim Sum, Buffets, Chinese, Szechuan, Asian Fusion",Tampa,0,Fushia Asian Bistro & Hot Pot Buffet,216,4.0,FL
640ba2188e928c352265e61c,Kyey3rqsPuNOgGlXuiqezQ,"Restaurants, Food, Mexican, Fast Food",Tampa,1,Chipotle Mexican Grill,100,2.0,FL
640ba2188e928c352265e620,TQKpK-ClRGtEFu_Qf7U-MQ,"Burgers, American (Traditional), Restaurants",Tampa,1,Red Robin Gourmet Burgers and Brews,184,3.0,FL
640ba2188e928c352265e623,e8VlQHJYDyfMo5J--qyY9g,"Donuts, Restaurants, Coffee & Tea, Food",Tampa,1,Krispy Kreme,87,3.0,FL
640ba2188e928c352265e624,UG9yclkxBcsHFb9U2Q_WdQ,"Restaurants, Chinese",Tampa,1,China Legend,30,4.5,FL
640ba2188e928c352265e625,GOcny-tWlN3jKk0AjHeAug,"Restaurants, American (New)",Tampa,1,The Grill At Morris Bridge,9,4.5,FL
640ba2188e928c352265e626,wEdzUMaLE2ebYoe7Z0XGaA,"Restaurants, Pizza",Tampa,1,Grimaldi's Pizzeria,480,4.0,FL
640ba2188e928c352265e629,pSULno65Tj4xEN6SMN_EQA,"Restaurants, Bars, Nightlife, American (Traditional)",Tampa,0,Red Dog Bar & Grill,21,3.5,FL
640ba2188e928c352265e62e,IAnOWXTZjNNUSdt5kdFjmg,"Food, Burgers, American (New), Restaurants",Tampa,0,Shula Burger,107,2.5,FL
640ba2188e928c352265e62f,1oWEY7aepUU3GXPAVlfDbg,"American (Traditional), Restaurants, Diners, Fast Food, Breakfast & Brunch",Tampa,1,Waffle House,18,3.0,FL
640ba2188e928c352265e634,2XFRm3DSYm6ULx0oPTpQCg,"American (New), Japanese, Restaurants, Chinese",Tampa,1,New Bamboo Express,53,3.5,FL
640ba2188e928c352265e636,WeDn7iD1ckcEg7YttkduWg,"Vegetarian, Restaurants, Latin American, New Mexican Cuisine, Tacos, Mexican",Tampa,1,Don Julio's Authentic Mexican Cuisine,203,4.0,FL
640ba2188e928c352265e639,W-8WTyb13DJNfhQf31awPQ,"Restaurants, Pizza",Tampa,0,Red Brick Pizza,6,3.0,FL
640ba2188e928c352265e63a,ga3gRASr7Jc_WK--EtsjKg,"Tex-Mex, American (Traditional), Beer, Wine & Spirits, Restaurants, Bars, Food, Nightlife",Tampa,0,Chili's,61,3.0,FL
640ba2188e928c352265e63f,jTNrCowWjPrpbUehvGBd1w,"Real Estate, Tennis, Social Clubs, Golf, Home Services, Venues & Event Spaces, Active Life, Arts & Entertainment, Country Clubs, Swimming Pools, Restaurants, Event Planning & Services",Tampa,1,Hunter's Green Country Club,8,4.0,FL
640ba2188e928c352265e642,un1uBFgmY42fP8vmGo8zMw,"Restaurants, Mexican, Tacos, Breakfast & Brunch, Fast Food, Tex-Mex",Tampa,1,Taco Bell,26,2.0,FL
640ba2188e928c352265e647,AauDx7QSes9nZOAAa4LIbQ,"Sushi Bars, Salad, Restaurants, Japanese",Tampa,1,Sushi House,212,4.5,FL
640ba2188e928c352265e648,6kGguKQkmMITO3n8H8EKOA,"Hawaiian, Restaurants, Sushi Bars, Food, Bubble Tea, Poke",Tampa,1,Poke Falls,38,4.0,FL
640ba2188e928c352265e650,IMRmWvquQBKsnE280Ra4wA,"Seafood, Fast Food, Restaurants",Tampa,1,Long John Silver's,13,3.0,FL
640ba2188e928c352265e653,H26zRyQkXXYzUZUOtppFcA,"Food, Tapas Bars, Gluten-Free, Tacos, Restaurants, Latin American, Tapas/Small Plates, Breakfast & Brunch, Bars, Mexican, Event Planning & Services, Caterers, Nightlife",Tampa,1,Green Lemon,1166,4.5,FL
640ba2188e928c352265e655,7L0WAmZ0fP5hKzdhVAkIhQ,"Restaurants, Food, Indian, Specialty Food, Buffets",Tampa,1,Curry Leaves Indian Cuisine,695,4.5,FL
640ba2188e928c352265e657,7wL-1JWa88df9OUtbbMHcQ,"American (Traditional), Bars, Nightlife, Hotels & Travel, Restaurants",Tampa,1,Corazon Restaurant And Bar,5,4.5,FL
640ba2188e928c352265e659,S-pwdOmtIPL2UCjQEvKROg,"Beer Bar, American (Traditional), Southern, Nightlife, Cocktail Bars, Restaurants, Spanish, Bars",Tampa,0,Fodder & Shine,257,3.5,FL
640ba2188e928c352265e65a,UWB_Oi9dkPwXfhYgFMnjsw,"Breakfast & Brunch, Restaurants, Food, Sandwiches, Diners, Coffee & Tea",Tampa,1,Pinky's,625,4.0,FL
640ba2188e928c352265e65f,_TKTiPOV97yJsRY40zI6xQ,"Chinese, Restaurants",Tampa,1,China King,23,4.5,FL
640ba2188e928c352265e660,7O_ZgEgu0D6HuGtIjHka7w,"Restaurants, Burgers, American (Traditional), Fast Food",Tampa,1,Checkers,13,2.0,FL
640ba2188e928c352265e662,r2uNRr2oookWMN3TST7uqg,"Restaurants, Chinese, Malaysian, Asian Fusion",Tampa,0,Kampong Asian Market Resaurant,40,4.0,FL
640ba2188e928c352265e664,K02hzlW5E9JvAGqppWpOew,"Italian, Restaurants, Chicken Wings, Burgers, Pizza",Tampa,0,Lucky's Pizza,10,1.0,FL
640ba2188e928c352265e66a,2baniRD5IsrjxHgs55O-8Q,"Food, Mexican, Restaurants",Tampa,0,Tijuana Flats,5,2.0,FL
640ba2188e928c352265e66d,8n2x93ZQ86yK-NGGJ_1Gng,"Restaurants, American (Traditional), Chicken Wings",Tampa,1,Wing Boyz,5,4.5,FL
640ba2188e928c352265e671,WdZCy06eIoTPI_n5dmbLGQ,"Restaurants, Breakfast & Brunch",Tampa,0,Potbellies Family Restaurant,43,3.5,FL
640ba2188e928c352265e674,XvFN7YQ-b6QjAAhAiEPW1g,"Sports Bars, American (New), Restaurants, Nightlife, Bars, Pizza",Tampa,0,Boston's Restaurant & Sports Bar,66,3.5,FL
640ba2188e928c352265e675,w22wji2KXOCF1AS-E36P-A,"Lounges, American (New), Restaurants, Bars, Italian, Nightlife",Tampa,0,Domani Bistro Lounge,82,4.5,FL
640ba2188e928c352265e677,rQiXAJVQxIAEQD1DVTAvKQ,"Food, Diners, Restaurants, Breakfast & Brunch, Coffee & Tea, Bakeries",Tampa,0,The Daily Dose Coffeehouse and Eatery,102,4.0,FL
640ba2188e928c352265e679,cyF4vtmQ4LhsYCHSARzk5Q,"Wine Bars, Desserts, Bars, Nightlife, Puerto Rican, Cajun/Creole, Restaurants, Caribbean, Food",Tampa,1,Bayou Bodega,14,4.5,FL
640ba2188e928c352265e67b,5jtYx1fDtc_JSfp6f61QxA,"Southern, Fast Food, American (Traditional), Restaurants, Chicken Wings",Tampa,1,Popeyes Louisiana Kitchen,21,2.5,FL
640ba2188e928c352265e67d,7fJBnez5H-gVSfJ2N3H81Q,"American (Traditional), Burgers, Food, Restaurants",Tampa,0,Ruby Tuesday,51,2.5,FL
640ba2188e928c352265e681,ZX4Pt8czAT7gea-zWkAnzg,"Specialty Food, Restaurants, Juice Bars & Smoothies, Food, Fruits & Veggies, Salad",Tampa,1,Harvest Station,31,4.5,FL
640ba2188e928c352265e68b,BxFWkJsm5A0lz7C_BFDm4Q,"Restaurants, Burgers, Steakhouses, Seafood",Tampa,1,Council Oak Steaks & Seafood,322,4.0,FL
640ba2188e928c352265e68d,A8eWhMmvWbAiuTZ3OtF_xA,"Sandwiches, Pizza, Restaurants, Chicken Wings",Tampa,0,Pizza Squared,199,4.0,FL
640ba2188e928c352265e690,iSXtAyf50ub_a0QAQBVCyA,"Restaurants, Pizza, Chicken Wings, Sandwiches",Tampa,0,Pizzazzone Brick Oven Pizzeria,20,4.5,FL
640ba2188e928c352265e693,5m6gQ3BwWi8QXcZmD4yulg,"Bubble Tea, Bakeries, Sandwiches, Vietnamese, Restaurants, Food",Tampa,1,Banh Mi Factory,59,4.5,FL
640ba2188e928c352265e695,7ptGQTkwnECXBmUmTF-Z9w,"Cajun/Creole, Restaurants, Seafood, Nightlife, Bars",Tampa,1,Mr & Mrs Crab,73,4.0,FL
640ba2188e928c352265e69b,C_X8oMrpm4yyeDpvBVCdvg,"Restaurants, Nightlife, Bars, American (Traditional)",Tampa,1,Ulele Bar,40,3.0,FL
640ba2188e928c352265e6a0,AL39YBhLIOc0jwBH-W-6sQ,"Caribbean, Restaurants",Tampa,0,Jerk Hut,58,3.5,FL
640ba2188e928c352265e6a5,yWz0fvBbxCCqMZy5-0OKVg,"Italian, Chicken Wings, Pizza, Restaurants",Tampa,1,Hungry Howie's Pizza & Subs,9,3.0,FL
640ba2188e928c352265e6a6,teWJvpV5UuMZKdWtMONvFQ,"Fast Food, Coffee & Tea, Food, Restaurants, Burgers",Tampa,1,McDonald's,34,1.5,FL
640ba2188e928c352265e6aa,07fzVDdsY_FM_eHjsUvYIQ,"Latin American, Restaurants, Puerto Rican, Caribbean, Barbeque, Chicken Shop",Tampa,1,Martin's BBQ,26,3.5,FL
640ba2188e928c352265e6ab,ewGp1BjKyVlD032yMd-lgQ,"American (Traditional), Restaurants, Sandwiches, Breakfast & Brunch, Cheesesteaks, Steakhouses, Diners",Tampa,1,Philly Phlava,134,4.0,FL
640ba2188e928c352265e6b1,U2bIdbGjmmpw3BQj20dn5g,"Bakeries, Desserts, Food, Cafes, Restaurants",Tampa,1,Zimo Bakery & Cafe,39,4.5,FL
640ba2188e928c352265e6b2,Jxe_xzKI4vFNHG_mG-04jg,"Soup, Desserts, Restaurants, Food, Mexican",Tampa,1,Margaritas Mexican Restaurant,170,3.0,FL
640ba2188e928c352265e6b6,F__yT5i7C2t-IfzyXYscKw,"Food, Coffee & Tea, Bubble Tea, Restaurants, Asian Fusion, Juice Bars & Smoothies",Tampa,1,Kung Fu Tea,293,4.0,FL
640ba2188e928c352265e6bb,Ul7iiiIR7AXcI6ta06SkjQ,"Restaurants, Indian",Tampa,1,Taj Indian Cuisine,180,3.5,FL
640ba2188e928c352265e6be,DMkMRN9xnIrtU0FMsxmALg,"Restaurants, Nightlife, Bars, Pizza, Sports Bars",Tampa,1,Islands Pizza,143,3.0,FL
640ba2188e928c352265e6c2,x-u3I8BseQF5hyOpd_tTSw,"Nightlife, Food, Smokehouse, Bars, Seafood, American (Traditional), Restaurants, Music Venues, Arts & Entertainment",Tampa,1,Skipper's Smokehouse,324,3.5,FL
640ba2188e928c352265e6c5,rFoap6lcuZ2IU6WzQsH1yQ,"Nightlife, Cocktail Bars, Restaurants, Breakfast & Brunch, Bars, Cafes",Tampa,1,Riverwalk Cafe at TMA,10,3.5,FL
640ba2188e928c352265e6ca,9U5fv2Iur8ibckTcC0KeZQ,"Shopping, Nightlife, Bars, Cocktail Bars, Tobacco Shops, Lounges, Restaurants, Latin American",Tampa,0,Mita's Kitchen,37,4.0,FL
640ba2188e928c352265e6cc,QU3cET055Ewld3x_bxEtqw,"American (Traditional), Sandwiches, Vegetarian, Coffee & Tea, Vegan, Restaurants, Desserts, Cafes, Patisserie/Cake Shop, Bagels, Bakeries, Food",Tampa,1,The Blind Tiger Cafe - Seminole Heights,73,4.5,FL
640ba2188e928c352265e6cd,u_OKSYmOEpjhLCD1ZsoEDA,"American (New), Vietnamese, French, Restaurants",Tampa,1,Restaurant BT,217,4.5,FL
640ba2188e928c352265e6d3,60wupyK0tPqVPeo5Dcl24w,"Bars, Art Galleries, Arts & Entertainment, Cocktail Bars, Steakhouses, Restaurants, Shopping, Nightlife",Tampa,1,Gallery Chophouse,13,4.0,FL
640ba2188e928c352265e6d7,VG_6ZamOZ3-s6ODu9BCmqQ,"Restaurants, Burgers, Fast Food, Food, Coffee & Tea",Tampa,1,McDonald's,27,1.5,FL
640ba2188e928c352265e6d8,tY80FC_d4VmZaroPlKfc8Q,"Food Delivery Services, Chicken Wings, American (Traditional), Pizza, Restaurants, Food",Tampa,1,H2 Kitchen + Pizzeria,17,4.5,FL
640ba2188e928c352265e6d9,TVv-Rijul-b1GoIZ_zq-7Q,"Restaurants, Food, Nightlife, Wine Bars, American (New), Coffee & Tea, Bars, Sandwiches, Breakfast & Brunch",Tampa,0,Pascal's Artisan Bistro & Gourmet Coffee,62,4.5,FL
640ba2188e928c352265e6dc,AOTm9kpzpMclxTVCrGmEmw,"Restaurants, Sandwiches",Tampa,1,Sonny's Sandwich,8,4.0,FL
640ba2188e928c352265e6dd,zS5CQZ4mFC9Q4uSzydcw9Q,"Chicken Wings, Italian, Sandwiches, Restaurants, Pizza",Tampa,1,Hungry Howie's Pizza & Subs,8,4.5,FL
640ba2188e928c352265e6df,m79_C1oZzyGhopd5eft8kg,"Cocktail Bars, Restaurants, Nightlife, American (New), Bars, Seafood",Tampa,1,Anchor and Brine,88,3.5,FL
640ba2188e928c352265e6e2,O01R-G6g5Ft8iwgy7I6jwg,"Bars, Nightlife, Cocktail Bars, Gastropubs, Restaurants",Tampa,1,Hotel Bar,142,4.5,FL
640ba2188e928c352265e6e6,0rM3Izz5hVz-_kf339YMeQ,"Restaurants, Food, Breakfast & Brunch, Coffee & Tea",Tampa,1,Starbucks,26,3.0,FL
640ba2188e928c352265e6e9,4DmcHKAcAk4xMnW8oDH--Q,"Restaurants, Caribbean",Tampa,1,Golden Krust Caribbean Restaurant,18,3.0,FL
640ba2188e928c352265e6ec,AiAR72GqabOqpzm2iJBsJA,"Lebanese, Middle Eastern, Halal, Syrian, Mediterranean, Greek, Restaurants",Tampa,0,Zaytoun Mediterranean Grill,70,4.0,FL
640ba2188e928c352265e6ed,JzUFlsQh5jWG0AHD0V8pIQ,"Wine Bars, Pizza, Sandwiches, Nightlife, Italian, Bars, Restaurants",Tampa,1,Chubby's Super Subs & Pizza,111,3.5,FL
640ba2188e928c352265e6ee,gHOK_W5uoOA14dcg7zsVXQ,"Food, Spanish, Grocery, Restaurants, Cuban",Tampa,1,La Teresita Grocery,28,4.5,FL
640ba2188e928c352265e6f2,tJRqP1scsqrDatoAoD_DTQ,"Delis, Cafes, Breakfast & Brunch, Seafood, Restaurants, American (New), American (Traditional)",Tampa,1,Candor Grille,27,5.0,FL
640ba2188e928c352265e6f9,5Wwjgmj-2f6CFq1nPMvfSg,"Pizza, Restaurants",Tampa,0,Westshore Pizza,5,4.0,FL
640ba2188e928c352265e6fe,FzZ2U0gLuhKVarDdXVWBQw,"Sandwiches, Restaurants, Cuban, Salad, Delis",Tampa,1,Bearss Sandwiches,69,4.5,FL
640ba2188e928c352265e6ff,maJ6SEgLcQQqVR8dqyWF0w,"Restaurants, Pakistani, Indian, Halal",Tampa,1,Zauq,47,4.5,FL
640ba2188e928c352265e702,Fu3QcNVVIQOHWTvxkOHy3g,"Coffee & Tea, Day Spas, Restaurants, Cafes, Massage, Skin Care, Beauty & Spas, Food, Hair Salons, Nail Salons",Tampa,0,Crown Royal Day Spa,9,4.0,FL
640ba2188e928c352265e703,ySyzC-hLWeRJCiTLBtcpvA,"Specialty Food, Meat Shops, Restaurants, Grocery, Delis, Food, Cuban",Tampa,1,Interbay Meat Market & Groceries,123,4.5,FL
640ba2188e928c352265e705,u5XgMHBbacyE7KC4kMWLVw,"Restaurants, Latin American, Ethnic Food, Specialty Food, Food, Empanadas",Tampa,1,Empanada World,32,4.5,FL
640ba2188e928c352265e707,EI0iUUbEi3xIy74L7-GrUQ,"Burgers, Sandwiches, Chicken Wings, Restaurants",Tampa,1,Twisted Turtle Bar And Grill,21,3.5,FL
640ba2188e928c352265e708,H6bB1rX0exhCMpvrt64FGQ,"Nightlife, American (Traditional), Pool Halls, Restaurants",Tampa,0,Barley's Billiards & Grille,20,4.0,FL
640ba2188e928c352265e70c,ZOBR5vCG0QNJsGnucs2vWw,"Event Planning & Services, Caterers, Cafes, Breakfast & Brunch, Delis, Food, Soup, Burgers, Salad, Food Delivery Services, Sandwiches, Coffee Roasteries, Restaurants",Tampa,1,The Cafe at Waterford,75,5.0,FL
640ba2188e928c352265e70d,HfJeU5-MzRGiO3nIJwnEqQ,"Restaurants, Thai",Tampa,1,Thai Sweet Basil,202,4.0,FL
640ba2188e928c352265e713,WBkKMlHY4CfcM_eOJdxJtw,"Breweries, Food, Nightlife, Restaurants, Bars",Tampa,1,Zydeco Brew Werks,209,4.5,FL
640ba2188e928c352265e719,wzQQRtEwnFNkycJy0mr3TQ,"Restaurants, American (Traditional)",Tampa,0,Ashley Street Grill,17,3.0,FL
640ba2188e928c352265e71b,xfgHHVLSFMFOdhp4MIJ-YA,"Restaurants, Ice Cream & Frozen Yogurt, Tapas/Small Plates, Food, Mexican",Tampa,0,La Unica Michoacana,7,4.5,FL
640ba2188e928c352265e71c,KgGzGUcxzj5EThqaZgObjA,"Restaurants, Food, Mexican, Food Trucks",Tampa,1,Taco King,12,4.5,FL
640ba2188e928c352265e71d,rZd29McH59UhpsXfDXf_Lg,"Bakeries, Restaurants, Food, Desserts, Coffee & Tea, Spanish, Mexican, Ice Cream & Frozen Yogurt",Tampa,0,Dulce Cafe Tacos & More,11,4.0,FL
640ba2188e928c352265e71e,-1oygVebK81K8JEPI6H6Lw,"Restaurants, Breakfast & Brunch, Bagels, Sandwiches, Food",Tampa,1,Bruegger's Bagels,72,4.0,FL
640ba2188e928c352265e71f,b2egw7DXjck9sKYcBc4NCQ,"Chinese, Restaurants",Tampa,1,Top China,22,4.0,FL
640ba2188e928c352265e723,f_E5dlBz-78uL8tTQYNPew,"Italian, Restaurants",Tampa,1,Cena,230,4.0,FL
640ba2188e928c352265e724,pCqAtxJDMv7ha57hOkB11w,"Bars, Food, Breweries, Pubs, American (Traditional), Sports Bars, Arts & Entertainment, Nightlife, Restaurants, Gastropubs, Music Venues",Tampa,0,World Of Beer,124,3.5,FL
640ba2188e928c352265e726,vaYy-IWyfh1ILji0l2TpzQ,"American (Traditional), Restaurants, Seafood",Tampa,1,Café Waterside,79,3.5,FL
640ba2188e928c352265e72a,EciZrwXmmaCyk0C-GPVrRg,"Restaurants, Italian",Tampa,0,Lauro Ristorante,48,4.0,FL
640ba2188e928c352265e72c,OtZ77hTbZbnXPeZU3855zg,"Delis, Restaurants, Soup, Event Planning & Services, Food, Caterers, Juice Bars & Smoothies",Tampa,1,Chow Bella,9,5.0,FL
640ba2188e928c352265e733,aiD1s5zPzi4nPZXaEa2mTw,"Latin American, American (New), Restaurants, Bars, Colombian, Nightlife",Tampa,1,Mi Bandera,63,4.0,FL
640ba2188e928c352265e735,3NPd2QRO5CusfJG9l94Ziw,"Restaurants, Pizza",Tampa,1,Marco's Pizza,9,3.5,FL
640ba2188e928c352265e737,fxhDq0pLy47JzG1uqaQx3w,"Restaurants, Ice Cream & Frozen Yogurt, Food, American (New), Sandwiches, American (Traditional)",Tampa,1,Farrell's On the Island,74,4.0,FL
