_id,business_id,categories,city,is_open,name,review_count,stars,state
640ba2188e928c352265edc7,ywIO9dHL3JbcsGHgG9LJvg,"Fast Food, Ice Cream & Frozen Yogurt, Restaurants, Burgers, Food",Tampa,1,Shake Shack,86,3.5,FL
640ba2188e928c352265edca,Mgcgy5ZCZvwzggV5xausug,"Beer Gardens, Food, Restaurants, Nightlife, Beer Bar, Pizza, Bars, Grocery",Tampa,1,Lee's Grocery,203,4.5,FL
640ba2188e928c352265edcf,9fk_aoH6bvdv_fJdKjhTWg,"Breakfast & Brunch, Nightlife, Mexican, Restaurants, Bars, Cocktail Bars",Tampa,0,Nueva Cantina,142,3.0,FL
640ba2188e928c352265edd4,iwrTMBArHOeDTHXfvs5vTQ,"Restaurants, Pizza",Tampa,1,Marco's Pizza,41,3.5,FL
640ba2188e928c352265edd5,yrATxGR69bE_2FG5XTStZw,"Caribbean, Restaurants",Tampa,1,Jamaican & American Cafe,12,4.5,FL
640ba2188e928c352265edd9,Dkd-YyNmNwVs8PzmEaTIXQ,"Vegetarian, Beer, Wine & Spirits, Food, Restaurants, Korean",Tampa,0,Arirang Korean Restaurant,296,4.5,FL
640ba2188e928c352265eddd,zUNLhP38aYc_PxCWMs6OBA,"Tacos, New Mexican Cuisine, Tex-Mex, Mexican, Restaurants, Bars, Cocktail Bars, Nightlife",Tampa,0,Victoria Tacos & Cerveza,133,4.0,FL
640ba2188e928c352265ede1,mii6CXydtG14Mp7JQ_ETGw,"Pizza, Restaurants",Tampa,1,Westshore Pizza,49,3.0,FL
640ba2188e928c352265ede3,DuSkiAYLadjRkASCdYrf6g,"Restaurants, Asian Fusion, American (New)",Tampa,0,Bin 27 Bistro,19,3.5,FL
640ba2188e928c352265ede4,bk8ECmNb5FaOCsiTMoJUWQ,"Restaurants, Food Court, Arts & Entertainment",Tampa,1,Dragon Fire Grill,17,3.0,FL
640ba2188e928c352265ede6,2Jh3irHzOb6UEo6ZVxwZUA,"Restaurants, Burgers, Pizza, Salad",Tampa,0,Island Breeze Pizzeria & Bar,32,1.5,FL
640ba2188e928c352265edeb,5g-nkIrQpmEq-2hB9MV7QQ,"Mediterranean, Restaurants, Italian",Tampa,0,Grey Salt,42,4.0,FL
640ba2188e928c352265edec,Ny6IoMTUnRO0EwtkLt8W6w,"Barbeque, Restaurants, Korean",Tampa,1,K - Chicken and Grill Korean BBQ,83,4.5,FL
640ba2188e928c352265edef,YxuL6qr_wBuTtZ79giR5fQ,"Food Trucks, Food, Mediterranean, Restaurants",Tampa,0,Pita Dream Tampa,7,5.0,FL
640ba2188e928c352265edf0,10_A64Th-vWyVKBfb7vBJQ,"Barbeque, Restaurants",Tampa,1,Murph's Barbeque,12,3.5,FL
640ba2188e928c352265edf3,-2wh7NTLkWEgsrLJvilnFQ,"Grocery, Food, Halal, Turkish, Seafood, Sandwiches, Restaurants, Mediterranean",Tampa,1,Istanbul Mediterranean Grill & Market,96,4.5,FL
640ba2188e928c352265edf4,AedSMCrVUMZkHgoOSTU4vw,"Food, Specialty Food, Restaurants, Italian, Cafes",Tampa,0,Mozzarella Bar,24,4.5,FL
640ba2188e928c352265ee00,Ctjan4wdzmkv6rLChBu4Ag,"Local Flavor, Restaurants, American (New)",Tampa,0,Silver Ring Cafe,6,4.0,FL
640ba2188e928c352265ee0e,lX5vyFhkQNEsUtmePKefWA,"Restaurants, Salad, Soul Food, Seafood, American (New)",Tampa,1,813 Salad And Seafood,16,3.5,FL
640ba2188e928c352265ee12,XOeFjVFVqo64eazG-mjoTQ,"Lebanese, Middle Eastern, Mediterranean, Restaurants",Tampa,0,Gyro Zone,187,4.5,FL
640ba2188e928c352265ee14,kHmvpYme4OoV8SKn0TlqAg,"Ice Cream & Frozen Yogurt, Desserts, Restaurants, Hot Dogs, Food, Juice Bars & Smoothies",Tampa,0,Twistee Treat - Gandy,40,3.5,FL
640ba2188e928c352265ee16,0g7s_CI35bXAHo_SATlHBQ,"Italian, Restaurants, Pizza",Tampa,1,Bocelli Modern Italian,11,4.5,FL
640ba2188e928c352265ee1a,hJ3BxyYXza5NAmI6xMaWjA,"Restaurants, Greek",Tampa,0,Louis Pappas Market Cafe,9,4.0,FL
640ba2188e928c352265ee1e,JZB7PVaS2dFb9-axZbZR8A,"Soul Food, Restaurants, Latin American, Southern, Venezuelan",Tampa,1,Bradleys Family Resturant,7,3.5,FL
640ba2188e928c352265ee20,jx-jcdN0gPMXUMAVjJBTpw,"Caribbean, Specialty Food, Desserts, Puerto Rican, Gluten-Free, Restaurants, Food Stands, Food, Bakeries, Vegan",Tampa,1,Oopsy Daisy Sweets,13,4.5,FL
640ba2188e928c352265ee21,Brq-BCgyGWnf26eLuYRMyg,"Burgers, Restaurants, Coffee & Tea, Food, Fast Food",Tampa,1,McDonald's,26,1.5,FL
640ba2188e928c352265ee22,PwyCrD96iySAAu_GWsZEpg,"Middle Eastern, Greek, Restaurants",Tampa,0,Pita Express,12,2.5,FL
640ba2188e928c352265ee23,ejkdLO7VtD9AgFaey7MMuA,"Lounges, Restaurants, Sports Bars, Nightlife, Irish, Pubs, Bars",Tampa,1,Irish 31,200,4.0,FL
640ba2188e928c352265ee28,BZu5xUhbszylD4T2HdotvQ,"Tacos, Restaurants, Mexican, Salad, Soup",Tampa,1,Tacos 4G,28,4.0,FL
640ba2188e928c352265ee29,mXBEJ8PFDoPCRN4p8tLm5Q,"Restaurants, Peruvian, Latin American",Tampa,0,Pollo Garden,20,4.5,FL
640ba2188e928c352265ee2d,lRhN4fsQLDLx2glkisX8nw,"Bars, Food, Burgers, Nightlife, Restaurants, Local Flavor, Beer, Wine & Spirits, Sports Bars",Tampa,0,Tank's Tap Room,11,2.5,FL
640ba2188e928c352265ee31,vnKauFEeeUp8KI0Nc94vwA,"Vegetarian, Restaurants, Mexican, Afghan, Buffets, Indian",Tampa,0,Curry In Hurry,28,4.0,FL
640ba2188e928c352265ee33,lMNB-M0rzOBZfhlmAUeLCA,"Restaurants, Fast Food, Sandwiches",Tampa,0,Subway,9,2.0,FL
640ba2188e928c352265ee36,hn3-6Oa6AzjZ-VmZ9BUw2A,"Sandwiches, Restaurants, Fast Food",Tampa,1,Subway,8,1.5,FL
640ba2188e928c352265ee38,Gkfi3qXHH_FHvJ0_omUztg,"Restaurants, Burgers, Fast Food, Food, Coffee & Tea",Tampa,1,McDonald's,52,2.0,FL
640ba2188e928c352265ee3c,fYwZcxcBzYJYFBHJPGy6PQ,"Food Trucks, Food, Mexican, New Mexican Cuisine, Tacos, Restaurants, Street Vendors",Tampa,1,Entre Fuegos Red Tacos,15,4.0,FL
640ba2188e928c352265ee3e,6wXzDNBNoN_lQ7zde3IX_g,"Steakhouses, Restaurants",Tampa,0,Sam Seltzer's Steakhouse,6,2.5,FL
640ba2188e928c352265ee43,PN5XfZbqf1SI1mZBYSJzVA,"Basque, Tapas Bars, Spanish, Restaurants",Tampa,0,Vizcaya Restaurante South,281,4.0,FL
640ba2188e928c352265ee46,s4TlyQw8yyoouwP4S3990w,"Kebab, Mediterranean, Restaurants, Breakfast & Brunch",Tampa,1,Kafee and Kabab,9,3.5,FL
640ba2188e928c352265ee48,ExsrjgDLRUtqDeTsUlCyQQ,"Restaurants, Bars, Cafes, Hookah Bars, Nightlife",Tampa,1,Habibi Cafe and Hookah Bar,60,3.0,FL
640ba2188e928c352265ee4c,xvKv0S6QIlI9lm1Y9ea0FQ,"Restaurants, Seafood, Salad, Diners, Greek, Fast Food, Middle Eastern, Mediterranean, Chicken Wings, Sandwiches",Tampa,1,Salem's Fresh Eats,44,3.5,FL
640ba2188e928c352265ee4e,2pXS9GDt2csyLRn6rQkR-w,"Restaurants, Italian",Tampa,0,Romano's Macaroni Grill,44,3.0,FL
640ba2188e928c352265ee51,Ks4r6DEqSbV8D2qc04RhTA,"Barbeque, Restaurants",Tampa,1,Mission BBQ,344,4.5,FL
640ba2188e928c352265ee52,4QUPNvG8MC2t2NTngpNgBg,"Food, Gluten-Free, Bakeries, Restaurants",Tampa,0,Stacy's Gluten Free Goodies,34,4.0,FL
640ba2188e928c352265ee54,58Vd48_6D1Myd_M1xWepJg,"Coffee & Tea, Restaurants, Food",Tampa,0,Starbucks,31,4.0,FL
640ba2188e928c352265ee55,UrxmZEWa_zqzuuqMF4sb7Q,"Restaurants, Chicken Shop",Tampa,1,Cluck Yeah!,5,3.5,FL
640ba2188e928c352265ee56,BrH77mxUh8pkS84-UPCIwg,"Latin American, Restaurants, Ethnic Food, Breakfast & Brunch, Food, Specialty Food, Imported Food, Sandwiches, Cuban, Local Flavor",Tampa,1,Abella's Sandwich Shop,7,4.5,FL
640ba2188e928c352265ee5d,VBoaaajtqB5vyyouPU2gAw,"American (New), Seafood, Burgers, Breakfast & Brunch, Bars, Restaurants, Pop-Up Restaurants, Nightlife",Tampa,1,Rose Bar Tampa,62,4.0,FL
640ba2188e928c352265ee5f,_PJRuNpXHmPCv9eGXA3sxg,"American (Traditional), Sports Bars, Restaurants, Burgers, Bars, Nightlife, Steakhouses",Tampa,1,Applebee's Grill + Bar,86,2.5,FL
640ba2188e928c352265ee62,bP0Xr_uQLPUdIdRFYU4K6w,"Fast Food, Delis, Sandwiches, Restaurants",Tampa,1,Firehouse Subs,29,3.0,FL
640ba2188e928c352265ee65,kAhT_pFlNuL3yfhKrpYRWQ,"Party & Event Planning, Coffee & Tea, Fast Food, Event Planning & Services, Food, Burgers, Restaurants",Tampa,1,McDonald's,23,2.0,FL
640ba2188e928c352265ee67,v347Ts8SSna1GCbzNVwLBA,"Burgers, Restaurants, American (Traditional), American (New)",Tampa,0,Ruby Tuesday,39,3.5,FL
640ba2188e928c352265ee68,NU1rYG90VUKNvFBMWW8a7Q,"Restaurants, Seafood, American (Traditional)",Tampa,1,Red Lobster,112,3.0,FL
640ba2188e928c352265ee69,-2CPhK6ik9ZBgFX_F-dkxQ,"Sandwiches, Fast Food, Restaurants",Tampa,1,Subway,5,2.0,FL
640ba2188e928c352265ee6b,ndXTjLUGO7_Mjm8PVSbsLQ,Restaurants,Tampa,0,Castaways Restaurant the,9,2.5,FL
640ba2188e928c352265ee6c,EptWzik5Jo9OVlXBUk-2RQ,"Restaurants, American (New), Bars, Cocktail Bars, Nightlife",Tampa,1,TASTE Downtown Tampa,32,4.0,FL
640ba2188e928c352265ee6d,NMcBODHNzlDF454hdSVFTQ,"Mexican, Fast Food, Restaurants, Tex-Mex",Tampa,1,Moe's Southwest Grill,54,2.5,FL
640ba2188e928c352265ee6e,RZCLY_q25X3oNq4gkM8aIA,"Restaurants, Tapas/Small Plates, Gluten-Free, Mexican",Tampa,1,Chronic Tacos,173,3.5,FL
640ba2188e928c352265ee70,yVWdKUu78DpOEis1kxUcLQ,"Colombian, Latin American, Restaurants",Tampa,1,La Cabana Restaurant,107,4.0,FL
640ba2188e928c352265ee73,nZU21gjtG_thw1kFQgWNsQ,"Sandwiches, Cuban, Delis, Restaurants",Tampa,1,Mr Special,13,4.5,FL
640ba2188e928c352265ee75,5VndA-SIzQCpf95AefjRYw,"Seafood, Restaurants",Tampa,1,Johnson's 40th St Seafood House,20,4.0,FL
640ba2188e928c352265ee76,g71iYkeIeoxB4ppkemK24Q,"Salad, Restaurants, Cafes, Burgers",Tampa,1,Renée's Bistro,8,4.0,FL
640ba2188e928c352265ee79,WaBJh7o0NhBe_3pioFO4mw,"Burgers, Fast Food, Ice Cream & Frozen Yogurt, Restaurants, Food",Tampa,1,Sonic Drive-In,31,3.0,FL
640ba2188e928c352265ee7a,RQ9RnhKijxH3vvBbXm323A,"Restaurants, Cafeteria",Tampa,1,Tampa General Cafeteria,6,3.0,FL
640ba2188e928c352265ee7b,LAtPOWQ6fUvaU64Yp9hyIg,"Restaurants, Soul Food, Southern, Seafood",Tampa,1,Mama's Soul Food Restaurant,114,4.0,FL
640ba2188e928c352265ee7f,T6pMNyBC9ouFV2Msdvybgw,"Restaurants, Mexican, Fast Food",Tampa,1,Chipotle Mexican Grill,116,2.5,FL
640ba2188e928c352265ee84,PbfNIx3gxaQXWHHJAbmh7w,"Thai, Restaurants, Noodles, Soup",Tampa,1,Rouen Thai,134,4.0,FL
640ba2188e928c352265ee85,v66ZTl8tOGWQs-Z6BJOEcA,"Mediterranean, Middle Eastern, Restaurants, Seafood, American (Traditional)",Tampa,1,Four Brothers Eatery,72,4.0,FL
640ba2188e928c352265ee8a,Mq0WkA8JjTnmSS9g3YDb1A,"Chinese, Restaurants",Tampa,1,New China,39,3.5,FL
640ba2188e928c352265ee8f,CBWODXrTMags0hD2-MOBew,"Restaurants, Steakhouses, Event Planning & Services, Breakfast & Brunch, Venues & Event Spaces, American (Traditional)",Tampa,0,Grillsmith - Midtown South Tampa,68,4.5,FL
640ba2188e928c352265ee91,Xjc5PHeYHlxcCq_9LLLO4w,"Mexican, Restaurants, Burgers, Sandwiches, Tacos",Tampa,0,Pearly's Beach Eats,17,4.5,FL
640ba2188e928c352265ee92,mASpdje22xMQkJoF88seSg,"Bars, Restaurants, American (Traditional), Nightlife, American (New)",Tampa,0,CJ's Tavern,5,3.0,FL
640ba2188e928c352265ee96,NpqT53ghpuSY540YaNc1Tw,"Restaurants, American (Traditional), Sandwiches",Tampa,0,Quiznos,8,3.0,FL
640ba2188e928c352265ee98,80nVSRONLpXRnjYMNVrq3g,"Food, Bakeries, Farmers Market, Soul Food, Juice Bars & Smoothies, Specialty Food, Restaurants, Arts & Entertainment, Italian, Farms, Breakfast & Brunch, Barbeque",Tampa,1,Fat Beet Farm,24,5.0,FL
640ba2188e928c352265ee9a,yN5IW4Y-hnR7zqQmvwugRQ,"Restaurants, Vegetarian, Mediterranean, Greek",Tampa,1,Little Greek Fresh Grill - Carrollwood,91,3.5,FL
640ba2188e928c352265ee9b,XRhKQxw8bQFF9iq-j721_Q,"Sandwiches, Restaurants, Cuban, Food Trucks, Cafes, Food, Latin American",Tampa,1,Las Palmas Latin Grill,210,4.5,FL
640ba2188e928c352265ee9d,-SCIBOTjKGJXmeMMPi-uoQ,"Spanish, Cuban, Sandwiches, Restaurants",Tampa,1,Papi's Cafe,7,5.0,FL
640ba2188e928c352265ee9e,OLLd_nKetGJAAlXbb7ot4Q,"Food Trucks, Restaurants, Mexican, Food, Tacos",Tampa,1,Big D's Grub Wagon,5,4.5,FL
640ba2188e928c352265ee9f,lykLJFARTz_boAGFPfe5_A,"Restaurants, Sandwiches, Fast Food",Tampa,0,Subway,12,2.5,FL
640ba2188e928c352265eea6,RHQqZzOxMKayp2LGzClNhg,"Restaurants, American (New)",Tampa,0,Fynn's Bar and Grill,6,2.5,FL
640ba2188e928c352265eea7,S-aqWmXiRT2XYCLYugdBdQ,"Restaurants, Greek, Seafood, Chicken Wings, Vegetarian",Tampa,1,Zeko's Mediterranean Grill,58,4.0,FL
640ba2188e928c352265eeab,T6c7iPO8Y4t_GQiyevZbiQ,"African, Ethiopian, Restaurants",Tampa,1,Mitmita Ethiopian Restaurant,117,4.5,FL
640ba2188e928c352265eeac,TIp9kHzG9bbjwI4bIHffUg,"Event Planning & Services, Restaurants, Venues & Event Spaces, Nightlife, Wine Bars, Caterers, American (New), Bars",Tampa,1,Mise En Place,402,4.0,FL
640ba2188e928c352265eeb0,mEXgQJ0c4gEdBUNyC6Y6qg,"Breakfast & Brunch, Restaurants, Coffee & Tea, Food, Coffee Roasteries",Tampa,1,Joffrey's Coffee & Tea,13,4.5,FL
640ba2188e928c352265eeb3,QNmJafB0HMG61NLK0V-TFQ,"Mexican, Restaurants",Tampa,0,Maria's Taqueria,6,4.0,FL
640ba2188e928c352265eeb4,1Sl5-YrdHQNwd_LuKbxQ7A,"Cocktail Bars, Restaurants, Bars, Tapas Bars, Nightlife",Tampa,1,Copper Shaker,30,4.5,FL
640ba2188e928c352265eeb9,eImAdebEDD47dMd6zIx4MQ,"Restaurants, Soul Food",Tampa,1,Al's Finger Licking Good Soul Food,27,4.5,FL
640ba2188e928c352265eeba,xNFOIAjbqge_fqoUJu3vDA,"Restaurants, Food, Sandwiches, Automotive, Convenience Stores, Gas Stations, Coffee & Tea",Tampa,1,Wawa,73,3.5,FL
640ba2188e928c352265eebd,R6a2iSKadKb9YO9tYNZoqA,"Restaurants, Fast Food, Chicken Wings, Chicken Shop",Tampa,1,KFC,26,2.0,FL
640ba2188e928c352265eec0,4KscCdMdkfSZZOn1qQOxzA,"American (Traditional), Nightlife, Chicken Wings, Sports Bars, Restaurants, Bars",Tampa,1,Glory Days Grill,126,3.5,FL
640ba2188e928c352265eec7,NIalPClWMSkh8zeABpxqHw,"Food Stands, Barbeque, Restaurants",Tampa,0,Banjo's BBQ Grill II,6,3.0,FL
640ba2188e928c352265eec9,JpAjXYIqFQJyibItoZ_hOg,"Nightlife, Modern European, Cocktail Bars, Bars, Restaurants, American (New)",Tampa,1,Oak and Ola,479,4.5,FL
640ba2188e928c352265eecb,LE_cu3K6WOHJE3c57LT4rg,"Restaurants, Japanese",Tampa,0,Cafe Japon,22,3.5,FL
640ba2188e928c352265eecc,bR3TcTiLN5UzQA7zvPu0vQ,"American (Traditional), Sports Bars, Restaurants, Bars, Nightlife",Tampa,1,Mother's,306,4.0,FL
640ba2188e928c352265eed1,UD8-6c5IH6sYY5SSRCgbwA,"Food Stands, Food, Gluten-Free, Desserts, Ice Cream & Frozen Yogurt, Restaurants, Food Trucks, Cupcakes, Custom Cakes, Patisserie/Cake Shop, Bakeries, Event Planning & Services, Caterers",Tampa,1,The Cake Girl,96,4.5,FL
640ba2188e928c352265eed3,oGzkyf2pxufRBUwzXm3Sdg,"Restaurants, Burgers, Salad, Pizza",Tampa,0,Wow! Fresh & Fast,97,4.0,FL
640ba2188e928c352265eed6,unjm4rIGc-ZzRxdzEPnc1g,"American (Traditional), Restaurants, Bars, Steakhouses, Wine Bars, Seafood, Nightlife",Tampa,1,Ruth's Chris Steak House,362,3.5,FL
640ba2188e928c352265eed8,oqP2M9bjNqqLI8TLLOyl3A,"Food, Restaurants, Food Trucks, Brazilian",Tampa,1,El Churrascaso Grill,14,4.0,FL
640ba2188e928c352265eed9,pr1-qcxYNoU2iNcRPr3Bfg,"Restaurants, Cuban, Sandwiches",Tampa,0,Havana Village Sandwich Shop,72,3.0,FL
640ba2188e928c352265eedc,kaQ-ReAmU-xO2XnQsMFwRg,"Sandwiches, Restaurants, American (New), Salad, Bars, American (Traditional), Burgers, Cocktail Bars, Nightlife, Beer Bar",Tampa,1,Doc B's Restaurant + Bar,480,4.0,FL
640ba2188e928c352265eee2,ysbTBbwqtqoA-37H4CW18Q,"Vegetarian, Indian, Restaurants",Tampa,0,Udipi Cafe,100,3.5,FL
640ba2188e928c352265eee7,uAfT0VoG989Y_MelwqfR8A,"Restaurants, Latin American",Tampa,1,Tropical Cuisine,16,4.0,FL
640ba2188e928c352265eeeb,E3njxl3VSN1JQOY4Z4IZqA,"Restaurants, Vietnamese, Asian Fusion",Tampa,1,North Star Eatery,15,3.0,FL
640ba2188e928c352265eeee,HO1KJ6Jwk3sU_UTIJGOLDA,"Restaurants, Indian, Pakistani",Tampa,1,Haveli Indian Kitchen,143,4.0,FL
640ba2188e928c352265eef0,iYdpvzHz1VgU2Tzre4mT9w,"Chinese, Restaurants",Tampa,1,China Dragon,26,3.0,FL
640ba2188e928c352265eef2,LO5y-6HMvZ_hmLh1FLVugg,"Restaurants, Food, Latin American, Custom Cakes, Grocery",Tampa,1,Quadro Supermarket,5,3.0,FL
640ba2188e928c352265eef4,8z0MdXn-oeGgIyq7hU63Fg,"Restaurants, American (Traditional), Steakhouses, Burgers, American (New), Fast Food, Breakfast & Brunch, Diners",Tampa,1,Steak ’n Shake,53,2.0,FL
640ba2188e928c352265eefd,2WvQNYUU9h3ddV3cRLtL2Q,"Puerto Rican, Dominican, Caribbean, Restaurants, Mexican, Spanish",Tampa,1,Mambos Cafe,26,4.0,FL
640ba2188e928c352265ef01,bt0fu6y5n9y3_lhwIt_Feg,"Salad, Burgers, Restaurants, Breakfast & Brunch, American (Traditional)",Tampa,0,Green Iguana,79,3.0,FL
640ba2188e928c352265ef02,xFvJazuir9VuVovt315Z9Q,"Japanese, Asian Fusion, Bars, Nightlife, Vietnamese, Restaurants, Sushi Bars",Tampa,0,BluWave Sushi Bar & Grill,70,4.0,FL
640ba2188e928c352265ef04,b6_DvuraM7hE-wo7HXzuWg,"Burgers, American (Traditional), Nightlife, Restaurants, Bars, Fast Food, Tiki Bars",Tampa,1,Big Bamboo Bayside,27,4.0,FL
640ba2188e928c352265ef05,cMqClyGGiaRBynMyXFPbNA,"Gluten-Free, American (New), Restaurants",Tampa,1,Fresh Kitchen New Tampa,48,4.5,FL
640ba2188e928c352265ef08,MgoBAUgSv6UM6RNhwyV-MA,"Food, Burgers, Restaurants, Coffee & Tea, Fast Food",Tampa,1,McDonald's,37,2.0,FL
640ba2188e928c352265ef0a,MQRZphoLZVK278Na2YjzgQ,"Food, Burgers, Donuts, Restaurants, Sandwiches",Tampa,1,Thee Burger Spot,278,4.5,FL
640ba2188e928c352265ef0d,FdLNzJYoe7U05uQSbK4zsA,"Ice Cream & Frozen Yogurt, Fast Food, Restaurants, Burgers, Food",Tampa,1,Sonic Drive-In,58,2.0,FL
640ba2188e928c352265ef10,SMviztovk60dkN63poU5Ig,"Restaurants, Pizza, American (Traditional), Sandwiches, Halal, Breakfast & Brunch, Mediterranean, Greek",Tampa,0,Blue Moon Pizza & Gyro,15,4.0,FL
640ba2188e928c352265ef14,Kep3QUZd96oyuOX5vX9evQ,"Food, Bakeries, French, Restaurants, Breakfast & Brunch, Coffee & Tea",Tampa,0,Piquant,500,4.0,FL
640ba2188e928c352265ef1a,7IoEVMWgTFjjaYG02eQAsw,Restaurants,Tampa,1,China Garden,19,3.0,FL
640ba2188e928c352265ef1b,ehqT-Pek95bMYQKx5_nKsg,"Nightlife, Bars, American (New), Restaurants",Tampa,1,The Barterhouse Ybor,98,4.5,FL
640ba2188e928c352265ef1e,imkVHD5m2H6eGY9zElui1g,"Restaurants, Sandwiches, Soup, Cuban",Tampa,0,La Ideal Sandwich Shop,25,4.0,FL
640ba2188e928c352265ef21,GcjznqyXcfnF4PxLMqOlYw,"Sandwiches, Fast Food, Restaurants, Vegetarian, Mediterranean",Tampa,0,Pita Pit,37,3.5,FL
640ba2188e928c352265ef22,sB_Sn9UOQj3U29WH290twQ,"Vegan, Gluten-Free, Bakeries, Restaurants, Food",Tampa,1,HaleLife Bakery,30,4.5,FL
640ba2188e928c352265ef24,GTNh2Jx56qE5kJSOVZxZlg,"Cuban, Food, Airports, Restaurants, Breweries, Hotels & Travel, Tours",Tampa,1,Cigar City Brewing,164,3.0,FL
640ba2188e928c352265ef27,4lq9BmUFUOU8eQXdJ1naog,"Restaurants, Fast Food, Chinese",Tampa,1,Panda Express,36,2.5,FL
640ba2188e928c352265ef29,qWtQmQt-ensEk3GWmPcKGg,"Bars, Restaurants, American (Traditional), Nightlife, Pubs",Tampa,0,World of Beer,6,4.0,FL
640ba2188e928c352265ef2e,FXsu9JqnLl2D0wqeQP4QKw,"Bars, Nightlife, American (New), Restaurants, Sports Bars",Tampa,1,Glory Days Grill,229,3.5,FL
640ba2188e928c352265ef30,yK0deBBwOwt9s26097XqoQ,"Nightlife, Irish Pub, Restaurants, Bars, Irish",Tampa,1,Molly Malone's Irish Pub,58,4.0,FL
640ba2188e928c352265ef37,NL_RDDQ_uPAT8t-x7hINvA,"Tacos, Mexican, Restaurants",Tampa,1,Xtreme Tacos - Seminole Heights,145,5.0,FL
640ba2188e928c352265ef3a,HgMt_C5AAo6dvnSfRajnKw,"Food, Food Stands, Restaurants, Food Trucks",Tampa,1,Mobile Munchiez,25,4.5,FL
640ba2188e928c352265ef3b,xcQy8NRwrKao8MovWchEeA,"Restaurants, Food, Burgers, Food Delivery Services",Tampa,1,MrBeast Burger,7,1.5,FL
640ba2188e928c352265ef3d,9xv_hrKXFRMndvtqSnD2fw,"Restaurants, Cafes",Tampa,0,Chili Gourmet Cafe,7,4.5,FL
640ba2188e928c352265ef3e,OMJA0FqJT5MuLRRNLk8xzQ,"Restaurants, Mexican, Seafood",Tampa,0,El Pescador,71,4.0,FL
640ba2188e928c352265ef45,v-8RXacBDtDpCju2Euf3yw,"Restaurants, Waffles, American (Traditional), Burgers, Shopping",Tampa,1,Pickford's Counter,45,4.5,FL
640ba2188e928c352265ef48,YQBfVmfg-zGnUBIMM2RAPA,"Nightlife, American (Traditional), Restaurants, Bars, Pubs",Tampa,1,Tom's Tavern,6,2.5,FL
640ba2188e928c352265ef4b,RXr_he4lSOueM1R1FztGRQ,"Pubs, Food, Bars, Restaurants, American (Traditional), Nightlife, Sports Bars, Dive Bars",Tampa,1,Longbar Pub & Grill,50,4.0,FL
640ba2188e928c352265ef50,xnwwDNfxKpmxv0r9mBqy2A,"Pizza, Restaurants",Tampa,1,Mangia Bene Pizzeria,150,2.5,FL
640ba2188e928c352265ef52,xqkfXTXZfiqSbD4hDgNdvg,"Pizza, Italian, Restaurants, Chicken Wings, Fast Food",Tampa,1,Pizza Hut,15,1.5,FL
640ba2188e928c352265ef56,gJSNa1bxwtY0dm1t-dh38w,"Chinese, Gluten-Free, Restaurants, Asian Fusion",Tampa,1,P.F. Chang's,377,3.0,FL
640ba2188e928c352265ef59,Ihumv0XtyeTwt1bIuwIXYA,"Restaurants, Lounges, Bars, Nightlife, American (New)",Tampa,0,The Point Bistro & Lounge,9,2.5,FL
640ba2188e928c352265ef5b,yO3C7jR9U95EHg5lPXNUGQ,"Event Planning & Services, Restaurants, Food, Chicken Shop, Caterers, Fast Food",Tampa,1,Chick-fil-A,33,3.0,FL
640ba2188e928c352265ef61,tZe5mvS13mPy0rk5ltuR9w,"Southern, Salad, Restaurants, Barbeque, Soul Food",Tampa,1,Shundra's Soul Smokehouse,48,4.0,FL
640ba2188e928c352265ef63,fNjozYBX0X4ES3ME7WVgXQ,"Chicken Shop, Fast Food, Chicken Wings, Restaurants",Tampa,1,KFC,13,2.5,FL
640ba2188e928c352265ef65,a1esN1yBrh8c8jra-7WcXw,"Sandwiches, Restaurants, Spanish, Salad, Breakfast & Brunch, Cuban, Caribbean",Tampa,1,Caribbean Twist,48,4.5,FL
640ba2188e928c352265ef66,5H5mKgROIfmYKHjFMCePCA,"Restaurants, Wine Bars, Salad, Nightlife, Italian, Bars, Soup",Tampa,1,Olive Garden Italian Restaurant,115,3.5,FL
640ba2188e928c352265ef67,Pa-UQ7SJIpa18yIIQ2u1Ow,"Restaurants, Chinese",Tampa,0,Peking Chinese Restaurant,5,3.0,FL
640ba2188e928c352265ef6c,t3fJsOcmghh-MJ-UNXDR3g,"Hot Dogs, Restaurants, Fast Food",Tampa,1,Mel's Hot Dogs,274,4.0,FL
640ba2188e928c352265ef7b,TGorJMfkBjDqee1ypYSj4w,"Mexican, Salad, Breakfast & Brunch, Restaurants",Tampa,1,Del Valle,5,2.5,FL
640ba2188e928c352265ef7c,906LNhIYthmVJlKdS40PYw,"Restaurants, Food, Coffee & Tea, Juice Bars & Smoothies, Waffles",Tampa,1,Dwntwn Social,32,4.5,FL
640ba2188e928c352265ef7d,R_5X96OM-b0fF9pZbzzy0g,"Restaurants, Pizza, Italian, Sandwiches",Tampa,1,Santoro's Pizzeria,89,4.5,FL
640ba2188e928c352265ef80,KJScP6bDksIDN329d6s8IQ,"Diners, Breakfast & Brunch, American (Traditional), Restaurants, Italian, Greek",Tampa,1,Joe's New York Diner,226,4.0,FL
640ba2188e928c352265ef81,CSiJiPKT_OOJ6CzB0R2_GQ,"Restaurants, Sandwiches, Fast Food",Tampa,1,Subway,8,2.5,FL
640ba2188e928c352265ef84,IaVPfkfX-kHMtxXcJNT4HA,"Acai Bowls, Food, Juice Bars & Smoothies, Organic Stores, Vegan, Restaurants",Tampa,0,SOHO Juice - Tampa,17,3.5,FL
640ba2188e928c352265ef88,PJ_n5QkoQUX8bhOgonGW2Q,"Latin American, Restaurants",Tampa,1,El Chuzo Bbq,60,4.0,FL
640ba2188e928c352265ef89,eFBvIX6wux0CFkhnBeFcoQ,"Restaurants, Chicken Wings, Pizza, Sandwiches",Tampa,1,Domino's Pizza,29,2.5,FL
640ba2188e928c352265ef8c,T-fj5vSoZN-KSE47jtCA3g,"Pizza, Restaurants",Tampa,1,Anthony's New York Style Pizza,99,3.0,FL
640ba2188e928c352265ef8d,hExi86DTBlmIhB2FLvqrHg,"Desserts, Restaurants, Bars, Nightlife, American (New), Food",Tampa,1,On Swann,1291,4.5,FL
640ba2188e928c352265ef8e,i7k-gVxU5Jjca3MCNSL4Sw,"Asian Fusion, Chinese, Nightlife, Restaurants, Bars",Tampa,1,Pei Wei Asian Diner,69,3.0,FL
640ba2188e928c352265ef8f,Ueb8isyTZyRycKJV1CjNlA,"Delis, Fast Food, Restaurants, Hot Dogs, Sandwiches",Tampa,0,Firehouse Subs,35,3.5,FL
640ba2188e928c352265ef91,L5LLN0RafiV1Z9cddzvuCw,"Breweries, Food, American (New), Beer, Wine & Spirits, Restaurants, Seafood",Tampa,1,Ulele,3064,4.0,FL
640ba2188e928c352265ef92,fzYu9Rh-oqlg95QzkbIO0A,"Food, American (New), Tapas/Small Plates, Mexican, Wine Bars, Restaurants, Gastropubs, Nightlife, Bars, Beer, Wine & Spirits, Tacos, Sandwiches, Cocktail Bars",Tampa,1,Taps Restaurant Bar & Lounge,334,3.5,FL
640ba2188e928c352265ef96,2FIMMCgpJyxRa3mVmFYn3A,"Nightlife, Restaurants, Cocktail Bars, Event Planning & Services, Bars, Gastropubs, Venues & Event Spaces, Lounges, Music Venues, Social Clubs, Arts & Entertainment, Beer Bar",Tampa,0,Franklin Manor,200,3.5,FL
640ba2188e928c352265ef9a,ZBdkOVCP1tDY-ODpJOmMaA,"Nightlife, Bars, Burgers, Food, Restaurants",Tampa,0,Square 1 Burgers & Bar,284,4.0,FL
640ba2188e928c352265ef9b,HNXpuOxyh9XPm9sM98Ao3A,"Pizza, Restaurants",Tampa,1,Cappy's Pizzeria,153,4.0,FL
640ba2188e928c352265ef9d,jkE-WnAES6wFLbH5GEWsYQ,"Food, Specialty Food, Ethnic Food, Vietnamese, Restaurants",Tampa,1,BT To Go,94,4.0,FL
640ba2188e928c352265efa0,jHtqYimdAVzlZEtmmoLY7w,"Restaurants, American (New)",Tampa,1,211,32,3.5,FL
640ba2188e928c352265efa1,LmsFBarEMorpSyw2vEwRAA,"Pizza, Italian, Restaurants, Filipino, Chicken Wings, Salad, Desserts, Sandwiches, Food",Tampa,1,Magdalena's Pizzeria,178,4.5,FL
640ba2188e928c352265efa4,LejMqzvUAz_pnf90OOBLkw,"Bakeries, Tutoring Centers, Food, Pop-Up Restaurants, Restaurants, Education",Tampa,0,Hey Giant,52,4.5,FL
640ba2188e928c352265efa5,Z0Bn-FdyZmXHBh8qQe9JLw,"Food Trucks, Restaurants, Burgers, Fast Food, Food",Tampa,1,Tnt burger,26,4.5,FL
640ba2188e928c352265efae,reteoNyLHrNYYpsJrAk08Q,"American (Traditional), Breakfast & Brunch, Restaurants, Diners, Waffles",Tampa,1,Waffle House,15,3.0,FL
640ba2188e928c352265efaf,pNN5ggRc5KUBsnIzDdf_2A,"Restaurants, Pubs, Gastropubs, Lounges, Bars, American (New), Wine Bars, Nightlife",Tampa,1,Mermaid Tavern,517,4.0,FL
640ba2188e928c352265efb0,-K0LoSCfh8i5U_y53Krepg,"Shopping, Nightlife, Shopping Centers, Bars, Restaurants, American (Traditional), Department Stores, Fashion",Tampa,1,International Plaza and Bay Street,261,4.5,FL
640ba2188e928c352265efb1,7sb5J_Gu5FCQJ-xxt2OTvg,"Restaurants, Indian",Tampa,1,Royal Orchid,83,2.5,FL
640ba2188e928c352265efb2,8HwpObQ5_CSMUaOj5gJFVw,"Restaurants, Mediterranean, Greek",Tampa,1,Kipos,21,2.5,FL
640ba2188e928c352265efb3,EbmrgI8VbCLcDSUhmW2xxQ,"Pizza, Restaurants",Tampa,0,Cappy's Pizzeria,6,4.0,FL
640ba2188e928c352265efb6,B4GSKwbA6Trut7sllL5Bsg,"Restaurants, American (Traditional), Breakfast & Brunch",Tampa,1,Le Peep,68,4.5,FL
640ba2188e928c352265efb8,DvBdqAA3XleMaOMwBl7g4g,"Sushi Bars, American (New), Asian Fusion, Restaurants",Tampa,1,Kona Grill - Tampa,792,3.5,FL
640ba2188e928c352265efb9,69ccjOpx2iFvr1y2qas9uA,"Coffee Roasteries, Food, Bakeries, Restaurants, Breakfast & Brunch, Drive-Thru Bars, Cafes, Bars, Coffee & Tea, Nightlife",Tampa,1,Caffeine Roasters,209,4.0,FL
640ba2188e928c352265efba,wtBpwPKKVF1vhm5Y0VTH7A,"Delis, Chicken Wings, Greek, Restaurants",Tampa,1,LaLa's Gyros,17,3.0,FL
640ba2188e928c352265efbe,h9SbhQRmoQmPcZlzp3JS9w,"Cafes, Restaurants, Delis",Tampa,1,Natures Table,33,4.0,FL
640ba2188e928c352265efc1,MoDEAVL_BnkfOEF_9hSUxw,"Fast Food, Food Trucks, Food, Middle Eastern, Mediterranean, Restaurants",Tampa,1,Halal Food Truck Hamada Maqluba,23,4.5,FL
640ba2188e928c352265efc3,hpCQiWEocCSWm0EQt0sLVw,"Food Trucks, Food, Restaurants, Latin American, Colombian, Venezuelan",Tampa,1,Lenos,24,4.5,FL
640ba2188e928c352265efc5,2f_iPtdEPRS9fVXWPdisEQ,"Sushi Bars, Japanese, Restaurants",Tampa,0,Sushi Hayashi,14,3.5,FL
640ba2188e928c352265efc9,mS_B6-fEgGSpsPTYELgSYQ,"Barbeque, Caterers, Event Planning & Services, American (New), Restaurants",Tampa,0,Sonny's BBQ,85,2.5,FL
